{
  "schema_version": "architecture-real-demo-fixture-schema-v1",
  "fixture_version": "architecture-real-demo-v1",
  "data_classification": "synthetic_anonymized",
  "contract_versions": {
    "architecture_advisor_ruleset": "architecture-advisor-v1",
    "generation_schema": "1.0",
    "generation_prompt": "1.2",
    "quality_contract": "1.1",
    "critic_schema": "1.0",
    "critic_prompt": "1.2",
    "repair_schema": "1.0",
    "repair_prompt": "1.0"
  },
  "advisor_cases": [
    {
      "case_id": "advisor_canonical_no_llm",
      "category": "canonical",
      "name": "Stabile regelbasierte Prüfung",
      "narrative": "Pflichtfelder und Schwellenwerte sind stabil, vollständig explizit und ohne semantische Interpretation prüfbar.",
      "complexity_context": "low",
      "answers": {
        "simpler_solution_sufficient": "yes",
        "semantic_reasoning_required": "no",
        "multiple_known_ai_steps_required": "no",
        "dynamic_orchestration_required": "no"
      },
      "expected": {
        "mode": "no_llm_required",
        "reason_codes": [
          "simpler_solution_sufficient"
        ],
        "why_no_agent_required": false,
        "open_points_expected": false
      }
    },
    {
      "case_id": "advisor_canonical_controlled_llm",
      "category": "canonical",
      "name": "Begrenzte semantische Klassifikation",
      "narrative": "Freitext muss semantisch eingeordnet werden; ein einzelner klar begrenzter LLM-Schritt genügt.",
      "complexity_context": "medium",
      "answers": {
        "simpler_solution_sufficient": "no",
        "semantic_reasoning_required": "yes",
        "multiple_known_ai_steps_required": "no",
        "dynamic_orchestration_required": "no"
      },
      "expected": {
        "mode": "controlled_llm",
        "reason_codes": [
          "controlled_llm_sufficient"
        ],
        "why_no_agent_required": true,
        "open_points_expected": false
      }
    },
    {
      "case_id": "advisor_canonical_llm_workflow",
      "category": "canonical",
      "name": "Fester mehrstufiger KI-Ablauf",
      "narrative": "Mehrere semantische KI-Schritte sind nötig, ihre Reihenfolge und Übergänge stehen vollständig im Voraus fest.",
      "complexity_context": "medium",
      "answers": {
        "simpler_solution_sufficient": "no",
        "semantic_reasoning_required": "yes",
        "multiple_known_ai_steps_required": "yes",
        "dynamic_orchestration_required": "no"
      },
      "expected": {
        "mode": "llm_workflow",
        "reason_codes": [
          "fixed_llm_workflow_sufficient"
        ],
        "why_no_agent_required": true,
        "open_points_expected": false
      }
    },
    {
      "case_id": "advisor_canonical_bounded_agent",
      "category": "canonical",
      "name": "Dynamische freigegebene Toolwahl",
      "narrative": "Der nächste zulässige Schritt oder das benötigte Tool hängt tatsächlich vom jeweils erreichten Zwischenzustand ab.",
      "complexity_context": "medium",
      "answers": {
        "simpler_solution_sufficient": "no",
        "semantic_reasoning_required": "yes",
        "multiple_known_ai_steps_required": "no",
        "dynamic_orchestration_required": "yes"
      },
      "expected": {
        "mode": "bounded_agent",
        "reason_codes": [
          "dynamic_orchestration_required"
        ],
        "why_no_agent_required": false,
        "open_points_expected": false
      }
    },
    {
      "case_id": "advisor_canonical_assessment_open",
      "category": "canonical",
      "name": "Unklare Zahl benötigter KI-Schritte",
      "narrative": "Semantische Verarbeitung ist erforderlich, aber es ist noch offen, ob ein einzelner oder mehrere feste KI-Schritte benötigt werden.",
      "complexity_context": "medium",
      "answers": {
        "simpler_solution_sufficient": "no",
        "semantic_reasoning_required": "yes",
        "multiple_known_ai_steps_required": "unclear",
        "dynamic_orchestration_required": "no"
      },
      "expected": {
        "mode": "assessment_open",
        "reason_codes": [
          "insufficient_information"
        ],
        "why_no_agent_required": false,
        "open_points_expected": true
      }
    },
    {
      "case_id": "advisor_adversarial_simpler_and_semantic",
      "category": "adversarial",
      "name": "Deterministisch ausreichend und LLM zugleich erforderlich",
      "narrative": "Die Anforderungen behaupten gleichzeitig, dass eine einfachere deterministische Lösung ausreicht und semantisches LLM-Reasoning zwingend erforderlich ist.",
      "complexity_context": "medium",
      "answers": {
        "simpler_solution_sufficient": "yes",
        "semantic_reasoning_required": "yes",
        "multiple_known_ai_steps_required": "no",
        "dynamic_orchestration_required": "no"
      },
      "expected": {
        "mode": "assessment_open",
        "reason_codes": [
          "contradictory_answers"
        ],
        "why_no_agent_required": false,
        "open_points_expected": true
      }
    },
    {
      "case_id": "advisor_adversarial_fixed_steps_and_dynamic",
      "category": "adversarial",
      "name": "Fester Mehrschritt und dynamische Orchestrierung zugleich",
      "narrative": "Mehrere feste KI-Schritte werden vollständig vorgegeben, gleichzeitig wird dynamische Orchestrierung als zwingend bezeichnet.",
      "complexity_context": "high",
      "answers": {
        "simpler_solution_sufficient": "no",
        "semantic_reasoning_required": "yes",
        "multiple_known_ai_steps_required": "yes",
        "dynamic_orchestration_required": "yes"
      },
      "expected": {
        "mode": "assessment_open",
        "reason_codes": [
          "contradictory_answers"
        ],
        "why_no_agent_required": false,
        "open_points_expected": true
      }
    },
    {
      "case_id": "advisor_adversarial_taxonomy_boundary",
      "category": "adversarial",
      "name": "Keine einfachere Lösung und kein semantisches Reasoning",
      "narrative": "Eine einfachere Standardlösung reicht nicht aus, semantisches LLM-Reasoning wird für die Aufgabe aber ebenfalls nicht benötigt.",
      "complexity_context": "medium",
      "answers": {
        "simpler_solution_sufficient": "no",
        "semantic_reasoning_required": "no",
        "multiple_known_ai_steps_required": "no",
        "dynamic_orchestration_required": "no"
      },
      "expected": {
        "mode": "assessment_open",
        "reason_codes": [
          "architecture_boundary_unclear"
        ],
        "why_no_agent_required": false,
        "open_points_expected": true
      }
    },
    {
      "case_id": "advisor_adversarial_dynamic_claim_fixed_flow",
      "category": "adversarial",
      "name": "Dynamische Toolwahl bei vollständig festem Ablauf behauptet",
      "narrative": "Alle KI-Schritte und Übergänge sind fest definiert; trotzdem wird zusätzlich behauptet, dass die Toolwahl dynamisch erfolgen müsse.",
      "complexity_context": "high",
      "answers": {
        "simpler_solution_sufficient": "no",
        "semantic_reasoning_required": "yes",
        "multiple_known_ai_steps_required": "yes",
        "dynamic_orchestration_required": "yes"
      },
      "expected": {
        "mode": "assessment_open",
        "reason_codes": [
          "contradictory_answers"
        ],
        "why_no_agent_required": false,
        "open_points_expected": true
      }
    },
    {
      "case_id": "advisor_adversarial_all_unclear",
      "category": "adversarial",
      "name": "Alle entscheidenden Antworten unklar",
      "narrative": "Für keine der vier Architekturfragen liegt bereits eine belastbare fachliche Antwort vor.",
      "complexity_context": "unknown",
      "answers": {
        "simpler_solution_sufficient": "unclear",
        "semantic_reasoning_required": "unclear",
        "multiple_known_ai_steps_required": "unclear",
        "dynamic_orchestration_required": "unclear"
      },
      "expected": {
        "mode": "assessment_open",
        "reason_codes": [
          "insufficient_information"
        ],
        "why_no_agent_required": false,
        "open_points_expected": true
      }
    },
    {
      "case_id": "advisor_adversarial_high_complexity_fixed_workflow",
      "category": "adversarial",
      "name": "Hohe Fachkomplexität bei vollständig festem Workflow",
      "narrative": "Die Domäne ist fachlich sehr komplex und stark reguliert, aber alle benötigten KI-Schritte und ihre Reihenfolge sind vollständig vorab definiert.",
      "complexity_context": "high",
      "answers": {
        "simpler_solution_sufficient": "no",
        "semantic_reasoning_required": "yes",
        "multiple_known_ai_steps_required": "yes",
        "dynamic_orchestration_required": "no"
      },
      "expected": {
        "mode": "llm_workflow",
        "reason_codes": [
          "fixed_llm_workflow_sufficient"
        ],
        "why_no_agent_required": true,
        "open_points_expected": false
      }
    },
    {
      "case_id": "advisor_adversarial_dynamic_countercontrol",
      "category": "adversarial",
      "name": "Echte dynamische Gegenkontrolle",
      "narrative": "Der nächste freigegebene Schritt ist nicht im Voraus festlegbar und muss abhängig von validierten Zwischenzuständen gewählt werden.",
      "complexity_context": "low",
      "answers": {
        "simpler_solution_sufficient": "no",
        "semantic_reasoning_required": "yes",
        "multiple_known_ai_steps_required": "no",
        "dynamic_orchestration_required": "yes"
      },
      "expected": {
        "mode": "bounded_agent",
        "reason_codes": [
          "dynamic_orchestration_required"
        ],
        "why_no_agent_required": false,
        "open_points_expected": false
      }
    }
  ],
  "quality_cases": [
    {
      "case_id": "quality_distinctiveness_near_identical",
      "kind": "semantic",